{
  "schema_version": "2.1",
  "version": "1.0.0",
  "last_updated": "October 2026",
  "project_scope": "anti-surveillance / face-obfuscation / makeup-adjacent artistic, research, and activism references",
  "ordering_definition": "Default rendering order is newest first. Primary key year descending; secondary key closeness descending; tertiary key title ascending. The HTML page also exposes a genealogy mode that reverses the year order.",
  "language": "en",
  "closeness_definition": {
    "description": "Integer 1-100 indicating how close a source is to the conceptual core of the project: face-centered anti-surveillance through appearance design, makeup, camouflage, or directly adjacent face-recognition attacks.",
    "anchor_examples": {
      "100": [
        "Michelle Tylicki + Lauri Love — DAZZLE",
        "Adam Harvey — CV Dazzle"
      ],
      "20": [
        "infrared / night-vision sensor disturbance references such as The Camera-Shy Hoodie"
      ]
    },
    "bands": {
      "90_100": "direct face-centered anti-surveillance / makeup / camouflage references",
      "70_89": "directly relevant face-recognition attack literature or strongly adjacent face-obfuscation work",
      "40_69": "enabling or adjacent adversarial-vision methods",
      "1_39": "peripheral or modality-shifted references, especially infrared / sensor-jamming / non-face-centric work"
    }
  },
  "tag_definitions": {
    "type": [
      "artistic",
      "research",
      "activism"
    ],
    "ghostati_testability_level": [
      "direct",
      "partial",
      "indirect",
      "contextual",
      "no"
    ],
    "intervention": [
      "adversarial-ml",
      "adversarial-optimization",
      "digital-perturbation",
      "decoy",
      "environmental-perturbation",
      "face-obfuscation",
      "false-face",
      "garment",
      "glasses",
      "hair",
      "infrared",
      "interactive-tool",
      "light",
      "makeup",
      "near-infrared",
      "optical",
      "orbital-region",
      "patch",
      "pattern",
      "performance",
      "printed",
      "projection",
      "public-walk",
      "representation-attack",
      "sensor-aware-material",
      "sensor-jamming",
      "semantic-perturbation",
      "shadow",
      "structured-light",
      "survey",
      "taxonomy",
      "textile",
      "toolkit",
      "wearable-accessory",
      "workshop",
      "asymmetry"
    ],
    "target": [
      "3d-face-recognition",
      "certified-defense",
      "deep-representation",
      "depth-face-recognition",
      "face-detection",
      "face-recognition",
      "face-verification",
      "image-classification",
      "machine-learning-models",
      "nir-face-recognition",
      "object-detection",
      "public-space-surveillance",
      "security-camera",
      "sensor-disturbance",
      "traffic-sign-recognition"
    ],
    "domain": [
      "3d",
      "browser",
      "digital",
      "environmental",
      "festival",
      "near-infrared",
      "optical",
      "physical-world",
      "printed",
      "public-space",
      "software-library",
      "visible-light",
      "wearable"
    ]
  },
  "references": [
    {
      "slug": "human-imperceptible-nir-face-attack",
      "title": "Human-Imperceptible Physical Adversarial Attack for NIR Face Recognition Models",
      "author": [
        "Songyan Xie",
        "Jinghang Wen",
        "Encheng Su",
        "Qiucheng Yu"
      ],
      "year": 2025,
      "link": "https://arxiv.org/abs/2504.15823",
      "type": "research",
      "closeness": 22,
      "description": "A physical attack on near-infrared face recognition using infrared-absorbing ink and optimized patches.",
      "visual_hint": "nir_subtle_points",
      "demonstrated": "The paper demonstrates a black-box physical adversarial patch for NIR face recognition, using infrared-absorbing ink, skin-reflection modeling, and optimized patch placement to improve attack success in digital and physical domains.",
      "ghostati_relevance": "Extends camouflage to NIR-specific materials, which the browser’s visible-light pipeline cannot test.",
      "ghostati_testability": {
        "level": "indirect",
        "reason": "Ghostmaxxing can document the concept of localized face-region perturbations, but it cannot verify NIR absorption, NIR imaging, or infrared-specific recognition models without dedicated hardware and models."
      },
      "intervention": [
        "infrared",
        "patch",
        "sensor-aware-material"
      ],
      "target": [
        "nir-face-recognition",
        "face-verification"
      ],
      "domain": [
        "physical-world",
        "near-infrared",
        "wearable"
      ],
      "limitations": "The reported results are tied to NIR cameras, tested models, patch materials, subject set, and controlled acquisition conditions. Effectiveness against visible-light systems, production deployments, or newer NIR pipelines is not established by this reference.",
      "reproducibility": "artifact-available",
      "citation": "Xie et al., arXiv 2025",
      "links": {
        "canonical": "https://arxiv.org/abs/2504.15823",
        "paper": "https://arxiv.org/abs/2504.15823",
        "project": null,
        "code": null,
        "video": null,
        "doi": "https://doi.org/10.48550/arXiv.2504.15823",
        "arxiv": "https://arxiv.org/abs/2504.15823"
      }
    },
    {
      "slug": "accessorize-in-the-dark",
      "title": "Accessorize in the Dark: A Security Analysis of Near-Infrared Face Recognition",
      "author": [
        "Amit Cohen",
        "Mahmood Sharif"
      ],
      "year": 2024,
      "link": "https://doi.org/10.1007/978-3-031-51479-1_3",
      "type": "research",
      "closeness": 22,
      "description": "A security analysis of near-infrared face recognition that adapts adversarial accessories to NIR-based systems used in access-control and high-stakes settings.",
      "visual_hint": "nir_points",
      "demonstrated": "The work tests NIR-based face recognition against physically realizable adversarial accessories, reporting high physical attack success across defended and undefended models.",
      "ghostati_relevance": "Shows why different camera spectra require different camouflage tests.",
      "ghostati_testability": {
        "level": "partial",
        "reason": "Ghostmaxxing can approximate the visible placement of a wearable accessory around the face, but cannot test NIR capture, NIR-specific perturbations, or defended NIR models in the browser."
      },
      "intervention": [
        "glasses",
        "near-infrared",
        "wearable-accessory"
      ],
      "target": [
        "nir-face-recognition",
        "face-verification"
      ],
      "domain": [
        "physical-world",
        "near-infrared",
        "wearable"
      ],
      "limitations": "The result depends on NIR capture assumptions, model set, accessory realization, and experimental protocol. A standard RGB webcam test in Ghostmaxxing would not confirm the NIR-specific claim.",
      "reproducibility": "code-available",
      "citation": "Cohen and Sharif, ESORICS 2023 / LNCS 2024",
      "links": {
        "canonical": "https://doi.org/10.1007/978-3-031-51479-1_3",
        "paper": "https://link.springer.com/chapter/10.1007/978-3-031-51479-1_3",
        "project": null,
        "code": "https://github.com/AmitCohen3/Accessorize-in-the-dark",
        "video": null,
        "doi": "https://doi.org/10.1007/978-3-031-51479-1_3",
        "arxiv": null
      }
    },
    {
      "slug": "dazzle",
      "title": "DAZZLE",
      "author": [
        "Michelle Tylicki",
        "Lauri Love"
      ],
      "year": 2023,
      "link": "https://www.michelletylicki.info/dazzle/",
      "type": "activism",
      "closeness": 100,
      "description": "An interactive salon by Michelle Tylicki and Lauri Love for teaching and testing anti-surveillance makeup.",
      "visual_hint": "salon_mask",
      "demonstrated": "The project demonstrates a salon-like interface for teaching Computer Vision Dazzle and testing camouflage against multiple facial recognition systems in an activist and public-learning context.",
      "ghostati_relevance": "Combines makeup, model feedback and public workshops.",
      "ghostati_testability": {
        "level": "direct",
        "reason": "Ghostmaxxing can directly retest the browser-lab logic of applying face-region visual interventions and comparing detection or matching behavior before and after the intervention."
      },
      "intervention": [
        "makeup",
        "face-obfuscation",
        "interactive-tool",
        "workshop"
      ],
      "target": [
        "face-detection",
        "face-recognition"
      ],
      "domain": [
        "physical-world",
        "browser",
        "visible-light",
        "festival"
      ],
      "limitations": "Public documentation describes the project and its testing ambition, but does not provide a full reproducible benchmark, exact model list, or protocol. Claims should be read as project documentation unless the implementation and results are independently released.",
      "reproducibility": "documented-project",
      "citation": "Tylicki and Love, DAZZLE, 2023",
      "links": {
        "canonical": "https://www.michelletylicki.info/dazzle/",
        "paper": null,
        "project": "https://www.michelletylicki.info/dazzle/",
        "code": null,
        "video": null,
        "doi": null,
        "arxiv": null
      }
    },
    {
      "slug": "physical-world-optical-attacks-3d-face",
      "title": "Physical-World Optical Adversarial Attacks on 3D Face Recognition",
      "author": [
        "Yanjie Li",
        "Yiquan Li",
        "Xuelong Dai",
        "Songtao Guo",
        "Bin Xiao"
      ],
      "year": 2023,